{
  "manifest": { "schema_version": "mathviz.project/v1", "engine_version": "0.3.0", "domain_versions": { "motion1d": "0.1.0" }, "adapter_versions": { "motion1d": "0.1.0" }, "capability_registry_version": "1.0.0", "source_problem": "P3-PURSUIT", "problem_id": "p3-pursuit" },
  "math": {
    "schemaVersion": "mathviz.math/v1", "problemId": "p3-pursuit", "domain": "motion1d",
    "statement": "Given: A starts at 0 m; A speed 5 m/s; B starts at 0 m at 10 s; B speed 144/5 km/h; catch time 80/3 s; catch position 400/3 m; 1 km/h equals 5/18 m/s.",
    "parameters": [],
    "entities": [
      { "id": "A", "kind": "body", "props": { "capability_id": "motion1d.constant_velocity", "initial_position": "math:fact:xA0", "segments": [{ "start": "math:fact:tA0", "velocity": "math:fact:vA" }] } },
      { "id": "B", "kind": "body", "props": { "capability_id": "motion1d.constant_velocity", "initial_position": "math:fact:xB0", "segments": [{ "start": "math:fact:tB0", "velocity": "math:fact:vB" }] } },
      { "id": "catch_marker", "kind": "event_marker", "props": { "event_id": "overtake" } }
    ],
    "source_facts": [
      { "fact_id": "xA0", "name": "A initial position", "unit": "m", "value": { "kind": "int", "value": "0" }, "provenance": { "kind": "problem_text", "span": { "text": "Given: A starts at 0 m; A speed 5 m/s; B starts at 0 m at 10 s; B speed 144/5 km/h; catch time 80/3 s; catch position 400/3 m; 1 km/h equals 5/18 m/s.", "start": 0, "end": 150 } } },
      { "fact_id": "tA0", "name": "A start time", "unit": "s", "value": { "kind": "int", "value": "0" }, "provenance": { "kind": "problem_text", "span": { "text": "Given: A starts at 0 m; A speed 5 m/s; B starts at 0 m at 10 s; B speed 144/5 km/h; catch time 80/3 s; catch position 400/3 m; 1 km/h equals 5/18 m/s.", "start": 0, "end": 150 } } },
      { "fact_id": "vA", "name": "A speed", "unit": "m/s", "value": { "kind": "int", "value": "5" }, "provenance": { "kind": "problem_text", "span": { "text": "Given: A starts at 0 m; A speed 5 m/s; B starts at 0 m at 10 s; B speed 144/5 km/h; catch time 80/3 s; catch position 400/3 m; 1 km/h equals 5/18 m/s.", "start": 0, "end": 150 } } },
      { "fact_id": "xB0", "name": "B initial position", "unit": "m", "value": { "kind": "int", "value": "0" }, "provenance": { "kind": "problem_text", "span": { "text": "Given: A starts at 0 m; A speed 5 m/s; B starts at 0 m at 10 s; B speed 144/5 km/h; catch time 80/3 s; catch position 400/3 m; 1 km/h equals 5/18 m/s.", "start": 0, "end": 150 } } },
      { "fact_id": "tB0", "name": "B start time", "unit": "s", "value": { "kind": "int", "value": "10" }, "provenance": { "kind": "problem_text", "span": { "text": "Given: A starts at 0 m; A speed 5 m/s; B starts at 0 m at 10 s; B speed 144/5 km/h; catch time 80/3 s; catch position 400/3 m; 1 km/h equals 5/18 m/s.", "start": 0, "end": 150 } } },
      { "fact_id": "vB_raw", "name": "B speed input", "unit": "km/h", "value": { "kind": "rational", "p": "144", "q": "5" }, "provenance": { "kind": "problem_text", "span": { "text": "Given: A starts at 0 m; A speed 5 m/s; B starts at 0 m at 10 s; B speed 144/5 km/h; catch time 80/3 s; catch position 400/3 m; 1 km/h equals 5/18 m/s.", "start": 0, "end": 150 } } },
      { "fact_id": "v_one_kmh", "name": "1 km/h", "unit": "km/h", "value": { "kind": "int", "value": "1" }, "provenance": { "kind": "problem_text", "span": { "text": "Given: A starts at 0 m; A speed 5 m/s; B starts at 0 m at 10 s; B speed 144/5 km/h; catch time 80/3 s; catch position 400/3 m; 1 km/h equals 5/18 m/s.", "start": 0, "end": 150 } } }
    ],
    "derived_facts": [
      { "fact_id": "vB", "name": "B canonical speed", "unit": "m/s", "value": { "kind": "int", "value": "8" }, "provenance": { "kind": "derived", "capability_id": "motion1d.unit_normalize", "inputs": ["fact:vB_raw"] } },
      { "fact_id": "v_one_kmh_ms", "name": "1 km/h in m/s", "unit": "m/s", "value": { "kind": "rational", "p": "5", "q": "18" }, "provenance": { "kind": "derived", "capability_id": "motion1d.unit_normalize", "inputs": ["fact:v_one_kmh"] } },
      { "fact_id": "catch_time", "name": "overtake time", "unit": "s", "value": { "kind": "rational", "p": "80", "q": "3" }, "provenance": { "kind": "derived", "capability_id": "motion1d.overtake_event", "inputs": ["entity:A", "entity:B"] } },
      { "fact_id": "catch_position", "name": "overtake position", "unit": "m", "value": { "kind": "rational", "p": "400", "q": "3" }, "provenance": { "kind": "derived", "capability_id": "motion1d.solve_position", "inputs": ["entity:A", "fact:catch_time"] } }
    ],
    "runtime_values": [], "constraints": [],
    "events": [{ "event_id": "overtake", "capability_id": "motion1d.overtake_event", "participants": ["entity:B", "entity:A"], "at": { "kind": "rational", "p": "80", "q": "3" } }],
    "assertions": [{ "assertion_id": "assert_overtake", "capability_id": "motion1d.overtake_event", "subject_refs": ["entity:A", "entity:B"], "expectation": "holds" }],
    "capabilities": ["motion1d.constant_velocity", "motion1d.unit_normalize", "motion1d.overtake_event", "motion1d.solve_position"]
  },
  "scene": {
    "schemaVersion": "mathviz.scene/v1", "sceneId": "p3_pursuit_scene", "viewport": { "width": 900, "height": 220, "margin": [30, 30, 36, 30] },
    "objects": [
      { "objectId": "axis", "primitive": "number_line", "binding": { "source": "math:fact:xA0.value" }, "label": "distance (m)" },
      { "objectId": "body_A", "primitive": "moving_body", "binding": { "source": "math:entity:A.position", "transform": { "kind": "scale", "params": { "domain_min": 0, "domain_max": 150, "range_min": 0, "range_max": 1 } } }, "label": "A", "style": { "fill": "#58a6ff" } },
      { "objectId": "body_B", "primitive": "moving_body", "binding": { "source": "math:entity:B.position", "transform": { "kind": "scale", "params": { "domain_min": 0, "domain_max": 150, "range_min": 0, "range_max": 1 } } }, "label": "B", "style": { "fill": "#f0883e" } },
      { "objectId": "catch_marker", "primitive": "marker", "binding": { "source": "math:entity:catch_marker.position", "transform": { "kind": "scale", "params": { "domain_min": 0, "domain_max": 150, "range_min": 0, "range_max": 1 } } }, "label": "event" },
      { "objectId": "catch_time_text", "primitive": "math_text", "binding": { "source": "math:fact:catch_time.value" }, "text": "t = {value} s" },
      { "objectId": "catch_pos_text", "primitive": "math_text", "binding": { "source": "math:fact:catch_position.value" }, "text": "x = {value} m" }
    ], "bindings": []
  },
  "timeline": {
    "schemaVersion": "mathviz.timeline/v1", "timelineId": "p3_pursuit_timeline", "duration": 18, "fps": 24,
    "tracks": [{ "track_id": "model_motion", "actions": [
      { "kind": "map_model_time", "from": 2, "to": 12, "model_from": { "t": "num", "v": { "kind": "int", "value": "0" } }, "model_to": { "t": "num", "v": { "kind": "rational", "p": "80", "q": "3" } }, "easing": "linear" },
      { "kind": "map_model_time", "from": 12, "to": 18, "model_from": { "t": "num", "v": { "kind": "rational", "p": "80", "q": "3" } }, "model_to": { "t": "num", "v": { "kind": "rational", "p": "80", "q": "3" } }, "easing": "linear" }
    ] }]
  }
}
