{"manifest":{"schema_version":"mathviz.project/v1","engine_version":"0.4.0","domain_versions":{"function2d":"0.1.0"},"adapter_versions":{"function2d":"0.1.0","sympy":"1.14.0"},"capability_registry_version":"1.0.0","problem_id":"p4-intersections"},"math":{"schemaVersion":"mathviz.math/v1","problemId":"p4-intersections","domain":"function2d","statement":"Curves y=x^2 and y=2x+3 intersect where x^2=2x+3, at x=-1 and x=3, i.e. points (-1,1) and (3,9).","parameters":[],"entities":[{"id":"f","kind":"function","label":"y=x^2","props":{"capability_id":"function2d.expression_curve","variable":"x","expr":{"t":"app","op":"^","args":[{"t":"sym","name":"x"},{"t":"num","v":{"kind":"int","value":"2"}}]},"x_domain":{"min":{"kind":"int","value":"-4"},"max":{"kind":"int","value":"4"}}}},{"id":"g","kind":"function","label":"y=2x+3","props":{"capability_id":"function2d.expression_curve","variable":"x","expr":{"t":"app","op":"+","args":[{"t":"app","op":"*","args":[{"t":"num","v":{"kind":"int","value":"2"}},{"t":"sym","name":"x"}]},{"t":"num","v":{"kind":"int","value":"3"}}]},"x_domain":{"min":{"kind":"int","value":"-4"},"max":{"kind":"int","value":"4"}}}},{"id":"pt_x_left","kind":"claim_point","props":{"fact_id":"x_left"}},{"id":"pt_x_right","kind":"claim_point","props":{"fact_id":"x_right"}}],"source_facts":[{"fact_id":"intersections_claim","name":"claimed intersections","value":{"kind":"int","value":"2"},"provenance":{"kind":"problem_text","span":{"text":"Curves y=x^2 and y=2x+3 intersect where x^2=2x+3, at x=-1 and x=3, i.e. points (-1,1) and (3,9).","start":0,"end":96}}}],"derived_facts":[{"fact_id":"x_left","name":"left intersection x","value":{"kind":"int","value":"-1"},"provenance":{"kind":"derived","capability_id":"function2d.intersection","inputs":["entity:f","entity:g"]}},{"fact_id":"x_right","name":"right intersection x","value":{"kind":"int","value":"3"},"provenance":{"kind":"derived","capability_id":"function2d.intersection","inputs":["entity:f","entity:g"]}}],"runtime_values":[],"constraints":[],"events":[],"assertions":[{"assertion_id":"assert_intersections","capability_id":"function2d.intersection","subject_refs":["fact:x_left","fact:x_right"],"expectation":"holds"}],"capabilities":["function2d.expression_curve","function2d.intersection"]},"scene":{"schemaVersion":"mathviz.scene/v1","sceneId":"p4_intersections_scene","viewport":{"width":800,"height":480,"margin":[24,24,24,24]},"objects":[{"objectId":"grid","primitive":"grid","binding":{"source":"math:entity:f"}},{"objectId":"axis","primitive":"axis","binding":{"source":"math:entity:f"}},{"objectId":"curve_f","primitive":"function_curve","binding":{"source":"math:entity:f"},"label":"y=x^2"},{"objectId":"curve_g","primitive":"function_curve","binding":{"source":"math:entity:g"},"label":"y=2x+3","style":{"stroke":"#7ee787"}},{"objectId":"pt_x_left","primitive":"point","binding":{"source":"math:entity:pt_x_left"},"label":"(-1,1)"},{"objectId":"pt_x_right","primitive":"point","binding":{"source":"math:entity:pt_x_right"},"label":"(3,9)"}],"bindings":[],"layoutRules":[{"kind":"cartesian_window","x_min":-4,"x_max":4,"y_min":-2,"y_max":10}]},"timeline":{"schemaVersion":"mathviz.timeline/v1","timelineId":"p4_intersections_timeline","duration":6,"fps":24,"tracks":[{"track_id":"static","actions":[{"kind":"map_model_time","from":1,"to":5,"model_from":{"t":"num","v":{"kind":"int","value":"0"}},"model_to":{"t":"num","v":{"kind":"int","value":"0"}}}]}]}}