{"manifest":{"schema_version":"mathviz.project/v1","engine_version":"0.4.0","domain_versions":{"function2d":"0.1.0"},"adapter_versions":{"function2d":"0.1.0","sympy":"1.14.0"},"capability_registry_version":"1.0.0","problem_id":"p4-equation"},"math":{"schemaVersion":"mathviz.math/v1","problemId":"p4-equation","domain":"function2d","statement":"Solve x^2-5x+6=0 exactly: the solutions are x=2 and x=3, seen where the parabola y=x^2-5x+6 crosses the x-axis.","parameters":[],"entities":[{"id":"eq","kind":"equation","label":"x^2-5x+6=0","props":{"capability_id":"function2d.solve_equation","variable":"x","lhs":{"t":"app","op":"+","args":[{"t":"app","op":"-","args":[{"t":"app","op":"^","args":[{"t":"sym","name":"x"},{"t":"num","v":{"kind":"int","value":"2"}}]},{"t":"app","op":"*","args":[{"t":"num","v":{"kind":"int","value":"5"}},{"t":"sym","name":"x"}]}]},{"t":"num","v":{"kind":"int","value":"6"}}]},"rhs":{"t":"num","v":{"kind":"int","value":"0"}}}},{"id":"f","kind":"function","label":"y=x^2-5x+6","props":{"capability_id":"function2d.expression_curve","variable":"x","expr":{"t":"app","op":"+","args":[{"t":"app","op":"-","args":[{"t":"app","op":"^","args":[{"t":"sym","name":"x"},{"t":"num","v":{"kind":"int","value":"2"}}]},{"t":"app","op":"*","args":[{"t":"num","v":{"kind":"int","value":"5"}},{"t":"sym","name":"x"}]}]},{"t":"num","v":{"kind":"int","value":"6"}}]},"x_domain":{"min":{"kind":"int","value":"0"},"max":{"kind":"int","value":"5"}}}}],"source_facts":[{"fact_id":"solutions_claim","name":"claimed solution count","value":{"kind":"int","value":"2"},"provenance":{"kind":"problem_text","span":{"text":"Solve x^2-5x+6=0 exactly: the solutions are x=2 and x=3, seen where the parabola y=x^2-5x+6 crosses the x-axis.","start":0,"end":111}}}],"derived_facts":[{"fact_id":"sol_left","name":"solution x=2","value":{"kind":"int","value":"2"},"provenance":{"kind":"derived","capability_id":"function2d.solve_equation","inputs":["entity:eq"]}},{"fact_id":"sol_right","name":"solution x=3","value":{"kind":"int","value":"3"},"provenance":{"kind":"derived","capability_id":"function2d.solve_equation","inputs":["entity:eq"]}}],"runtime_values":[],"constraints":[],"events":[],"assertions":[{"assertion_id":"assert_solutions","capability_id":"function2d.solve_equation","subject_refs":["fact:sol_left","fact:sol_right"],"expectation":"holds"}],"capabilities":["function2d.expression_curve","function2d.solve_equation"]},"scene":{"schemaVersion":"mathviz.scene/v1","sceneId":"p4_equation_scene","viewport":{"width":800,"height":480,"margin":[24,24,24,24]},"objects":[{"objectId":"grid","primitive":"grid","binding":{"source":"math:entity:f"}},{"objectId":"axis","primitive":"axis","binding":{"source":"math:entity:f"}},{"objectId":"curve_f","primitive":"function_curve","binding":{"source":"math:entity:f"},"label":"y=x^2-5x+6"},{"objectId":"pt_sol_left","primitive":"point","binding":{"source":"math:fact:sol_left.point"},"label":"x=2"},{"objectId":"pt_sol_right","primitive":"point","binding":{"source":"math:fact:sol_right.point"},"label":"x=3"}],"bindings":[],"layoutRules":[{"kind":"cartesian_window","x_min":0,"x_max":5,"y_min":-1,"y_max":8}]},"timeline":{"schemaVersion":"mathviz.timeline/v1","timelineId":"p4_equation_timeline","duration":6,"fps":24,"tracks":[{"track_id":"static","actions":[{"kind":"map_model_time","from":1,"to":5,"model_from":{"t":"num","v":{"kind":"int","value":"0"}},"model_to":{"t":"num","v":{"kind":"int","value":"0"}}}]}]}}
