{"manifest":{"schema_version":"mathviz.project/v1","engine_version":"0.4.0","domain_versions":{"function2d":"0.1.0"},"adapter_versions":{"function2d":"0.1.0","sympy":"1.14.0"},"capability_registry_version":"1.0.0","problem_id":"p4-quadratic-sweep"},"math":{"schemaVersion":"mathviz.math/v1","problemId":"p4-quadratic-sweep","domain":"function2d","statement":"The parabola y=(x-a)^2-1 sweeps parameter a from -2 to 2 as a(t)=-2+4t; its roots a-1 and a+1 and vertex (a,-1) move together.","parameters":[{"id":"a","min":{"kind":"int","value":"-2"},"max":{"kind":"int","value":"2"},"default":{"kind":"int","value":"0"}}],"entities":[{"id":"f","kind":"function","label":"y=(x-a)^2-1","props":{"capability_id":"function2d.expression_curve","variable":"x","expr":{"t":"app","op":"-","args":[{"t":"app","op":"^","args":[{"t":"app","op":"-","args":[{"t":"sym","name":"x"},{"t":"sym","name":"a"}]},{"t":"num","v":{"kind":"int","value":"2"}}]},{"t":"num","v":{"kind":"int","value":"1"}}]},"x_domain":{"min":{"kind":"int","value":"-5"},"max":{"kind":"int","value":"5"}},"parameter_bindings":{"a":"math:runtime:a_at_t"}}}],"source_facts":[{"fact_id":"a_lo","name":"sweep start","value":{"kind":"int","value":"-2"},"provenance":{"kind":"problem_text","span":{"text":"The parabola y=(x-a)^2-1 sweeps parameter a from -2 to 2 as a(t)=-2+4t; its roots a-1 and a+1 and vertex (a,-1) move together.","start":0,"end":126}}},{"fact_id":"a_hi","name":"sweep end","value":{"kind":"int","value":"2"},"provenance":{"kind":"problem_text","span":{"text":"The parabola y=(x-a)^2-1 sweeps parameter a from -2 to 2 as a(t)=-2+4t; its roots a-1 and a+1 and vertex (a,-1) move together.","start":0,"end":126}}}],"derived_facts":[{"fact_id":"root_left","name":"left root a-1","value":{"kind":"symbolic","expr":{"t":"app","op":"-","args":[{"t":"sym","name":"a"},{"t":"num","v":{"kind":"int","value":"1"}}]}},"provenance":{"kind":"derived","capability_id":"function2d.roots","inputs":["entity:f"]}},{"fact_id":"root_right","name":"right root a+1","value":{"kind":"symbolic","expr":{"t":"app","op":"+","args":[{"t":"sym","name":"a"},{"t":"num","v":{"kind":"int","value":"1"}}]}},"provenance":{"kind":"derived","capability_id":"function2d.roots","inputs":["entity:f"]}},{"fact_id":"vertex_x","name":"vertex x-coordinate a","value":{"kind":"symbolic","expr":{"t":"sym","name":"a"}},"provenance":{"kind":"derived","capability_id":"function2d.extremum","inputs":["entity:f"]}}],"runtime_values":[{"id":"a_at_t","expr":{"t":"app","op":"+","args":[{"t":"num","v":{"kind":"int","value":"-2"}},{"t":"app","op":"*","args":[{"t":"num","v":{"kind":"int","value":"4"}},{"t":"sym","name":"t"}]}]},"unit":"1"}],"constraints":[],"events":[],"assertions":[{"assertion_id":"assert_roots","capability_id":"function2d.roots","subject_refs":["fact:root_left","fact:root_right"],"expectation":"holds"},{"assertion_id":"assert_vertex","capability_id":"function2d.extremum","subject_refs":["fact:vertex_x"],"expectation":"holds"}],"capabilities":["function2d.expression_curve","function2d.roots","function2d.extremum","function2d.parameter_sweep"]},"scene":{"schemaVersion":"mathviz.scene/v1","sceneId":"p4_quadratic_sweep_scene","viewport":{"width":800,"height":480,"margin":[24,24,24,24]},"objects":[{"objectId":"grid","primitive":"grid","binding":{"source":"math:entity:f"}},{"objectId":"axis","primitive":"axis","binding":{"source":"math:entity:f"}},{"objectId":"curve_f","primitive":"function_curve","binding":{"source":"math:entity:f"},"label":"y=(x-a)^2-1"},{"objectId":"pt_root_left","primitive":"point","binding":{"source":"math:fact:root_left.point"},"label":"a-1"},{"objectId":"pt_root_right","primitive":"point","binding":{"source":"math:fact:root_right.point"},"label":"a+1"},{"objectId":"pt_vertex","primitive":"point","binding":{"source":"math:fact:vertex_x.point"},"label":"vertex"}],"bindings":[],"layoutRules":[{"kind":"cartesian_window","x_min":-5,"x_max":5,"y_min":-2,"y_max":12}]},"timeline":{"schemaVersion":"mathviz.timeline/v1","timelineId":"p4_quadratic_sweep_timeline","duration":12,"fps":24,"tracks":[{"track_id":"sweep","actions":[{"kind":"map_model_time","from":1,"to":11,"model_from":{"t":"num","v":{"kind":"int","value":"0"}},"model_to":{"t":"num","v":{"kind":"int","value":"1"}}}]}]}}
