{"manifest":{"schema_version":"mathviz.project/v1","engine_version":"0.4.0","domain_versions":{"function2d":"0.1.0"},"adapter_versions":{"function2d":"0.1.0","sympy":"1.14.0"},"capability_registry_version":"1.0.0","problem_id":"p4-derivative-extrema"},"math":{"schemaVersion":"mathviz.math/v1","problemId":"p4-derivative-extrema","domain":"function2d","statement":"For f(x)=x^3-3x the derivative f'(x)=3x^2-3 vanishes at x=-1 (local max, f=2) and x=1 (local min, f=-2); also f'(2)=9 and f(2)=2.","parameters":[],"entities":[{"id":"f","kind":"function","label":"y=x^3-3x","props":{"capability_id":"function2d.expression_curve","variable":"x","expr":{"t":"app","op":"-","args":[{"t":"app","op":"^","args":[{"t":"sym","name":"x"},{"t":"num","v":{"kind":"int","value":"3"}}]},{"t":"app","op":"*","args":[{"t":"num","v":{"kind":"int","value":"3"}},{"t":"sym","name":"x"}]}]},"x_domain":{"min":{"kind":"int","value":"-3"},"max":{"kind":"int","value":"3"}}}}],"source_facts":[{"fact_id":"x_eval","name":"evaluation point","value":{"kind":"int","value":"2"},"provenance":{"kind":"problem_text","span":{"text":"For f(x)=x^3-3x the derivative f'(x)=3x^2-3 vanishes at x=-1 (local max, f=2) and x=1 (local min, f=-2); also f'(2)=9 and f(2)=2.","start":0,"end":129}}}],"derived_facts":[{"fact_id":"stat_max_x","name":"stationary max x=-1","value":{"kind":"int","value":"-1"},"provenance":{"kind":"derived","capability_id":"function2d.extremum","inputs":["entity:f"]}},{"fact_id":"stat_min_x","name":"stationary min x=1","value":{"kind":"int","value":"1"},"provenance":{"kind":"derived","capability_id":"function2d.extremum","inputs":["entity:f"]}},{"fact_id":"d_at2","name":"f'(2)","value":{"kind":"int","value":"9"},"provenance":{"kind":"derived","capability_id":"function2d.derivative_at","inputs":["entity:f","fact:x_eval"]}},{"fact_id":"v_at2","name":"f(2)","value":{"kind":"int","value":"2"},"provenance":{"kind":"derived","capability_id":"function2d.value_at","inputs":["entity:f","fact:x_eval"]}}],"runtime_values":[],"constraints":[],"events":[],"assertions":[{"assertion_id":"assert_extrema","capability_id":"function2d.extremum","subject_refs":["fact:stat_max_x","fact:stat_min_x"],"expectation":"holds"},{"assertion_id":"assert_derivative_at","capability_id":"function2d.derivative_at","subject_refs":["fact:d_at2"],"expectation":"holds"},{"assertion_id":"assert_value_at","capability_id":"function2d.value_at","subject_refs":["fact:v_at2"],"expectation":"holds"}],"capabilities":["function2d.expression_curve","function2d.derivative_at","function2d.extremum","function2d.value_at"]},"scene":{"schemaVersion":"mathviz.scene/v1","sceneId":"p4_derivative_extrema_scene","viewport":{"width":800,"height":480,"margin":[24,24,24,24]},"objects":[{"objectId":"grid","primitive":"grid","binding":{"source":"math:entity:f"}},{"objectId":"axis","primitive":"axis","binding":{"source":"math:entity:f"}},{"objectId":"curve_f","primitive":"function_curve","binding":{"source":"math:entity:f"},"label":"y=x^3-3x"},{"objectId":"pt_max","primitive":"point","binding":{"source":"math:fact:stat_max_x.point"},"label":"max (-1,2)"},{"objectId":"pt_min","primitive":"point","binding":{"source":"math:fact:stat_min_x.point"},"label":"min (1,-2)"},{"objectId":"pt_d2","primitive":"point","binding":{"source":"math:fact:d_at2.point"},"label":"f'(2)=9"},{"objectId":"pt_v2","primitive":"point","binding":{"source":"math:fact:v_at2.point"},"label":"f(2)=2"}],"bindings":[],"layoutRules":[{"kind":"cartesian_window","x_min":-3,"x_max":3,"y_min":-6,"y_max":10}]},"timeline":{"schemaVersion":"mathviz.timeline/v1","timelineId":"p4_derivative_extrema_timeline","duration":6,"fps":24,"tracks":[{"track_id":"static","actions":[{"kind":"map_model_time","from":1,"to":5,"model_from":{"t":"num","v":{"kind":"int","value":"0"}},"model_to":{"t":"num","v":{"kind":"int","value":"0"}}}]}]}}
